{
  "name": "recorded.revit.create_wall3",
  "description": "Recorded workflow with 6 steps",
  "adapter": "workflow",
  "parameters": {
    "type": "object",
    "properties": {},
    "required": []
  },
  "workflow": {
    "steps": [
      {
        "id": "step1",
        "tool": "revit.create_wall",
        "args": {
          "start_point": [
            -269.35415135061834,
            58.54947952566523,
            -5.611022647993498e-15
          ],
          "end_point": [
            -184.3904618882744,
            -72.2831290738211,
            -5.611022647993497e-15
          ],
          "level_name": "L1_43_High",
          "type_name": "Foundation - 24\" Concrete",
          "height": 12
        }
      },
      {
        "id": "step2",
        "tool": "revit.create_wall",
        "args": {
          "start_point": [
            -184.3904618882744,
            -72.2831290738211,
            -5.611022647993497e-15
          ],
          "end_point": [
            -76.09513241459908,
            -113.85381122107621,
            -5.611022647993497e-15
          ],
          "level_name": "L1_43_High",
          "type_name": "Foundation - 24\" Concrete",
          "height": 12
        }
      },
      {
        "id": "step3",
        "tool": "revit.create_wall",
        "args": {
          "start_point": [
            -76.09513241459908,
            -113.85381122107621,
            -5.611022647993497e-15
          ],
          "end_point": [
            48.61252573036015,
            -41.853811221076285,
            -5.611022647993497e-15
          ],
          "level_name": "L1_43_High",
          "type_name": "Foundation - 24\" Concrete",
          "height": 12
        }
      },
      {
        "id": "step4",
        "tool": "revit.create_wall",
        "args": {
          "start_point": [
            48.61252573036015,
            -41.853811221076285,
            -5.611022647993497e-15
          ],
          "end_point": [
            39.683697091112265,
            85.83438721218124,
            -5.611022647993497e-15
          ],
          "level_name": "L1_43_High",
          "type_name": "Foundation - 24\" Concrete",
          "height": 12
        }
      },
      {
        "id": "step5",
        "tool": "revit.create_wall",
        "args": {
          "start_point": [
            39.68369709111227,
            85.83438721218126,
            -5.611022647993498e-15
          ],
          "end_point": [
            -150.84189174146397,
            195.83438721218175,
            -5.611022647993497e-15
          ],
          "level_name": "L1_43_High",
          "type_name": "Foundation - 24\" Concrete",
          "height": 12
        }
      },
      {
        "id": "step6",
        "tool": "revit.create_wall",
        "args": {
          "start_point": [
            -150.84189174146397,
            195.83438721218175,
            -5.611022647993498e-15
          ],
          "end_point": [
            -243.56027719814273,
            158.3737278705906,
            -5.611022647993497e-15
          ],
          "level_name": "L1_43_High",
          "type_name": "Foundation - 24\" Concrete",
          "height": 12
        }
      }
    ]
  },
  "governance": {
    "author": "Dalton",
    "version": "1.0.0",
    "permission_mode": "write"
  }
}