{
  "name": "recorded.revit.create_wall_cap_test",
  "description": "Recorded workflow with 6 steps",
  "adapter": "workflow",
  "parameters": {
    "type": "object",
    "properties": {
      "level_name": {
        "type": "string",
        "description": "Workflow parameter: level_name",
        "default": "L2"
      },
      "type_name": {
        "type": "string",
        "description": "Workflow parameter: type_name",
        "default": "Exterior - Brick on Mtl. Stud"
      },
      "height": {
        "type": "integer",
        "description": "Workflow parameter: height",
        "default": 20
      }
    },
    "required": []
  },
  "workflow": {
    "steps": [
      {
        "id": "step1",
        "tool": "revit.create_wall",
        "args": {
          "start_point": [
            -27.435679445725043,
            75.97282095777034,
            8.083333333337128
          ],
          "end_point": [
            -9.435679445725043,
            75.97282095777028,
            8.083333333337128
          ],
          "level_name": "L2",
          "type_name": "Exterior - Brick on Mtl. Stud",
          "height": 20
        },
        "bindings": {
          "level_name": "$input.level_name",
          "type_name": "$input.type_name",
          "height": "$input.height"
        }
      },
      {
        "id": "step2",
        "tool": "revit.create_wall",
        "args": {
          "start_point": [
            -9.435679445725045,
            75.97282095777028,
            8.083333333337128
          ],
          "end_point": [
            -3.8220637936454978,
            102.38280617758302,
            8.083333333337128
          ],
          "level_name": "L2",
          "type_name": "Exterior - Brick on Mtl. Stud",
          "height": 20
        },
        "bindings": {
          "level_name": "$input.level_name",
          "type_name": "$input.type_name",
          "height": "$input.height"
        }
      },
      {
        "id": "step3",
        "tool": "revit.create_wall",
        "args": {
          "start_point": [
            -3.8220637936454973,
            102.38280617758302,
            8.083333333337128
          ],
          "end_point": [
            -10.631921289738667,
            115.74790404040856,
            8.083333333337128
          ],
          "level_name": "L2",
          "type_name": "Exterior - Brick on Mtl. Stud",
          "height": 20
        },
        "bindings": {
          "level_name": "$input.level_name",
          "type_name": "$input.type_name",
          "height": "$input.height"
        }
      },
      {
        "id": "step4",
        "tool": "revit.create_wall",
        "args": {
          "start_point": [
            -10.631921289738667,
            115.74790404040856,
            8.083333333337128
          ],
          "end_point": [
            -27.43567944572492,
            118.10951823778802,
            8.083333333337128
          ],
          "level_name": "L2",
          "type_name": "Exterior - Brick on Mtl. Stud",
          "height": 20
        },
        "bindings": {
          "level_name": "$input.level_name",
          "type_name": "$input.type_name",
          "height": "$input.height"
        }
      },
      {
        "id": "step5",
        "tool": "revit.create_wall",
        "args": {
          "start_point": [
            -27.435679445724922,
            118.10951823778802,
            8.083333333337128
          ],
          "end_point": [
            -37.138073237928374,
            107.33391826836582,
            8.083333333337128
          ],
          "level_name": "L2",
          "type_name": "Exterior - Brick on Mtl. Stud",
          "height": 20
        },
        "bindings": {
          "level_name": "$input.level_name",
          "type_name": "$input.type_name",
          "height": "$input.height"
        }
      },
      {
        "id": "step6",
        "tool": "revit.create_wall",
        "args": {
          "start_point": [
            -37.138073237928374,
            107.33391826836582,
            8.083333333337128
          ],
          "end_point": [
            -37.13807323792842,
            82.33391826836582,
            8.083333333337128
          ],
          "level_name": "L2",
          "type_name": "Exterior - Brick on Mtl. Stud",
          "height": 20
        },
        "bindings": {
          "level_name": "$input.level_name",
          "type_name": "$input.type_name",
          "height": "$input.height"
        }
      }
    ]
  },
  "governance": {
    "author": "Dalton",
    "version": "1.0.0",
    "permission_mode": "write"
  }
}