{
  "name": "dynamo.make_sphere",
  "adapter": "dynamo",
  "description": "Dynamo graph that creates a sphere in the active Revit document.",
  "version": "1.0.0",
  "tags": ["dynamo", "geometry"],
  "permissions": {
    "mode": "write"
  },
  "side_effects": ["creates_elements"],
  "parameters": {
    "type": "object",
    "properties": {
      "graph_path": {
        "type": "string",
        "description": "Path to the Dynamo graph file (default: D:\\OneDrive\\My Stuff\\GitHub\\All-Sorts-of-Dynamo-Scripts\\Advisor_tests\\make sphere.dyn)"
      },
      "inputs": {
        "type": "object",
        "description": "Key-value pairs mapping Dynamo input node names to their values",
        "additionalProperties": true
      }
    },
    "required": ["graph_path"]
  },
  "returns": {
    "type": "object",
    "properties": {
      "outputs": { "type": "object" },
      "message": { "type": "string" }
    }
  },
  "examples": []
}
