{
  "name": "recorded.revit.create_wall45",
  "description": "Recorded workflow with 3 steps",
  "adapter": "workflow",
  "parameters": {
    "type": "object",
    "properties": {},
    "required": []
  },
  "workflow": {
    "steps": [
      {
        "id": "step1",
        "tool": "revit.create_wall",
        "args": {
          "start_point": [
            -83.82179912879059,
            60.70699026493429,
            52.666666666670686
          ],
          "end_point": [
            -79.22938592585704,
            55.42402320337487,
            52.666666666670686
          ],
          "level_name": "R1",
          "type_name": "Exterior - Brick on Mtl. Stud",
          "height": 20
        }
      },
      {
        "id": "step2",
        "tool": "revit.create_wall",
        "args": {
          "start_point": [
            -79.22938592585704,
            55.42402320337487,
            52.666666666670686
          ],
          "end_point": [
            -72.79264347903684,
            56.32864835961529,
            52.666666666670686
          ],
          "level_name": "R1",
          "type_name": "Exterior - Brick on Mtl. Stud",
          "height": 20
        }
      },
      {
        "id": "step3",
        "tool": "revit.create_wall",
        "args": {
          "start_point": [
            -72.79264347903684,
            56.32864835961529,
            52.666666666670686
          ],
          "end_point": [
            -72.79264347903683,
            63.32864835961529,
            52.666666666670686
          ],
          "level_name": "R1",
          "type_name": "Exterior - Brick on Mtl. Stud",
          "height": 20
        }
      }
    ]
  },
  "governance": {
    "author": "Dalton",
    "version": "1.0.0",
    "permission_mode": "write"
  }
}