{
  "name": "recorded.revit.create_element_duct44",
  "description": "Recorded workflow with 4 steps",
  "adapter": "workflow",
  "parameters": {
    "type": "object",
    "properties": {},
    "required": []
  },
  "workflow": {
    "steps": [
      {
        "id": "step1",
        "tool": "revit.create_element",
        "args": {
          "start_point": [
            -94.0837291209956,
            86.3986552401351,
            16.36485635968497
          ],
          "end_point": [
            -95.96483990928677,
            91.56696465445759,
            16.36485635968497
          ],
          "level_name": "L2",
          "type_name": "Tees",
          "diameter": 0.3333333333333333,
          "category": "Ducts"
        }
      },
      {
        "id": "step2",
        "tool": "revit.create_element",
        "args": {
          "start_point": [
            -95.73960155853217,
            91.79220300521222,
            16.364856359684964
          ],
          "end_point": [
            -91.72219922216748,
            95.80960534157687,
            16.36485635968497
          ],
          "level_name": "L2",
          "type_name": "Tees",
          "diameter": 0.3333333333333333,
          "category": "Ducts"
        }
      },
      {
        "id": "step3",
        "tool": "revit.create_element",
        "args": {
          "start_point": [
            -91.41906211325356,
            95.69324190778023,
            16.364856359684964
          ],
          "end_point": [
            -82.38639495719546,
            92.22592584612384,
            16.36485635968497
          ],
          "level_name": "L2",
          "type_name": "Tees",
          "diameter": 0.3333333333333333,
          "category": "Ducts"
        }
      },
      {
        "id": "step4",
        "tool": "revit.create_element",
        "args": {
          "start_point": [
            -82.49341216373858,
            91.79670327456034,
            16.364856359684964
          ],
          "end_point": [
            -84.56369201759249,
            83.49326430963987,
            16.36485635968497
          ],
          "level_name": "L2",
          "type_name": "Tees",
          "diameter": 0.3333333333333333,
          "category": "Ducts"
        }
      }
    ]
  },
  "governance": {
    "author": "Dalton",
    "version": "1.0.0",
    "permission_mode": "write"
  }
}