{
  "name": "dynamo.make__walls",
  "adapter": "dynamo",
  "description": "Dynamo graph that creates walls in the active Revit document.",
  "visibility": "user",
  "version": "1.0.0",
  "tags": [
    "dynamo",
    "walls"
  ],
  "parameters": {
    "type": "object",
    "properties": {
      "graph_path": {
        "type": "string",
        "description": "Path to the Dynamo graph file (default: D:\\OneDrive\\My Stuff\\GitHub\\All-Sorts-of-Dynamo-Scripts\\Advisor_tests\\Make Walls.dyn)",
        "default": "D:\\OneDrive\\My Stuff\\GitHub\\All-Sorts-of-Dynamo-Scripts\\Advisor_tests\\Make Walls.dyn"
      },
      "inputs": {
        "type": "object",
        "description": "Key-value pairs mapping Dynamo input node names to their values"
      }
    },
    "required": [
      "graph_path"
    ]
  },
  "side_effects": [
    "creates_elements"
  ],
  "permissions": {
    "mode": "write"
  }
}