{
  "name": "composed.create_wall_test",
  "description": "Composed workflow: recorded.revit.create_wall \u2192 revit.create_element \u2192 revit.create_wall",
  "adapter": "workflow",
  "parameters": {
    "type": "object",
    "properties": {
      "type_name": {
        "type": "string",
        "description": "Workflow parameter: type_name"
      },
      "level_name": {
        "type": "string",
        "description": "Workflow parameter: level_name"
      },
      "diameter": {
        "type": "string",
        "description": "Workflow parameter: diameter"
      },
      "height": {
        "type": "string",
        "description": "Workflow parameter: height"
      },
      "width": {
        "type": "string",
        "description": "Workflow parameter: width"
      },
      "wall_type": {
        "type": "string",
        "description": "Workflow parameter: wall_type"
      }
    },
    "required": []
  },
  "workflow": {
    "steps": [
      {
        "id": "step1",
        "tool": "recorded.revit.create_wall",
        "args": {}
      },
      {
        "id": "step2",
        "tool": "revit.create_element",
        "args": {
          "start_point": null,
          "end_point": null,
          "type_name": null,
          "level_name": null,
          "diameter": null,
          "height": null,
          "width": null,
          "category": null
        },
        "bindings": {
          "type_name": "$input.type_name",
          "level_name": "$input.level_name",
          "diameter": "$input.diameter",
          "height": "$input.height",
          "width": "$input.width"
        }
      },
      {
        "id": "step3",
        "tool": "revit.create_wall",
        "args": {
          "start_point": null,
          "end_point": null,
          "height": null,
          "wall_type": null,
          "level_name": null
        },
        "bindings": {
          "height": "$input.height",
          "wall_type": "$input.wall_type",
          "level_name": "$input.level_name"
        }
      }
    ]
  },
  "governance": {
    "author": "Dalton",
    "version": "1.0.0",
    "permission_mode": "write",
    "side_effects": [
      "creates_elements"
    ]
  }
}