{
  "name": "recorded.test",
  "description": "Recorded workflow with 4 steps",
  "adapter": "workflow",
  "parameters": {
    "type": "object",
    "properties": {},
    "required": []
  },
  "workflow": {
    "steps": [
      {
        "id": "step1",
        "tool": "revit.create_element",
        "args": {
          "start_point": [
            -80.0015993482071,
            49.059555327194914,
            56.33333333333713
          ],
          "end_point": [
            -80.42013819067184,
            55.04493962875386,
            56.33333333333713
          ],
          "level_name": "R1",
          "type_name": "Tees"
        }
      },
      {
        "id": "step2",
        "tool": "revit.create_element",
        "args": {
          "start_point": [
            -80.0660836005494,
            55.17380496086378,
            56.33333333333712
          ],
          "end_point": [
            -77.13121401792115,
            56.2420101303937,
            56.33333333333713
          ],
          "level_name": "R1",
          "type_name": "Tees"
        }
      },
      {
        "id": "step3",
        "tool": "revit.create_element",
        "args": {
          "start_point": [
            -76.91613303477936,
            56.08574464917602,
            56.33333333333712
          ],
          "end_point": [
            -71.46809505729652,
            52.12751336434637,
            56.33333333333713
          ],
          "level_name": "R1",
          "type_name": "Tees"
        }
      },
      {
        "id": "step4",
        "tool": "revit.create_element",
        "args": {
          "start_point": [
            -71.42604218086996,
            51.9453623446605,
            56.33333333333712
          ],
          "end_point": [
            -70.23086425840529,
            46.768478008027564,
            56.33333333333713
          ],
          "level_name": "R1",
          "type_name": "Tees"
        }
      }
    ]
  },
  "governance": {
    "author": "Dalton",
    "version": "1.0.0",
    "permission_mode": "write"
  }
}